{
  "mapId": "last-mile-map-2",
  "coordinateSystem": "glb_x_right_y_up_z_south",
  "nodes": [
    {
      "nodeId": "N00",
      "label": "安全集结院",
      "position": [-16, 1.077772314920433, 9],
      "sceneId": null,
      "playable": true
    },
    {
      "nodeId": "N01",
      "label": "西门检查站",
      "position": [-11, 1.0393662652318638, 5],
      "sceneId": "E1",
      "playable": true
    },
    {
      "nodeId": "N02",
      "label": "旧市集",
      "position": [-4, 1.0480626409858003, 1],
      "sceneId": "E2",
      "playable": true
    },
    {
      "nodeId": "N03",
      "label": "社区诊所",
      "position": [-8, 1.0444149808394372, -5],
      "sceneId": null,
      "playable": false
    },
    {
      "nodeId": "N04",
      "label": "山脊通信站",
      "position": [-1, 1.2767261400413372, -9],
      "sceneId": null,
      "playable": false
    },
    {
      "nodeId": "N05",
      "label": "主桥西端",
      "position": [3, 1.326, -1],
      "sceneId": "E3",
      "playable": true
    },
    {
      "nodeId": "N06",
      "label": "主桥东端",
      "position": [7, 1.326, -1],
      "sceneId": null,
      "playable": true
    },
    {
      "nodeId": "N07",
      "label": "曙光撤离站",
      "position": [15, 1.0303142489414885, -8],
      "sceneId": null,
      "playable": true
    },
    {
      "nodeId": "N08",
      "label": "南侧服务路",
      "position": [-1, 1.0846364366509171, 8],
      "sceneId": null,
      "playable": true
    },
    {
      "nodeId": "N09",
      "label": "旧河床便道",
      "position": [6, 0.9476931089266111, 7],
      "sceneId": null,
      "playable": true
    },
    {
      "nodeId": "N10",
      "label": "仓储转运区",
      "position": [12, 1.0369488083422276, 2],
      "sceneId": null,
      "playable": true
    }
  ],
  "routes": [
    {
      "routeId": "R00",
      "fromNode": "N00",
      "toNode": "N01",
      "durationMs": 30000,
      "bidirectional": true,
      "waypoints": [
        [-16.0, 1.077772314920433, 9.0],
        [-15.5, 1.0907510582906115, 8.35],
        [-15.0, 1.1072428718772578, 7.7],
        [-14.5, 1.0983109463637937, 7.275],
        [-14.0, 1.0859596304887604, 6.85],
        [-13.5, 1.0764263235345384, 6.425],
        [-13.0, 1.0653718501307905, 6.0],
        [-12.333333333333334, 1.0543970281449984, 5.666666666666667],
        [-11.666666666666666, 1.0445993823084794, 5.333333333333333],
        [-11, 1.0393662652318638, 5]
      ],
      "enabled": true
    },
    {
      "routeId": "R01",
      "fromNode": "N01",
      "toNode": "N02",
      "durationMs": 45000,
      "bidirectional": true,
      "waypoints": [
        [-11.0, 1.0393662652318638, 5.0],
        [-10.333333333333334, 1.0413287795670891, 4.633333333333333],
        [-9.666666666666666, 1.0491337597318213, 4.266666666666667],
        [-9.0, 1.060780747762708, 3.9],
        [-8.4, 1.0716357614348744, 3.5999999999999996],
        [-7.8, 1.0810781620836767, 3.3],
        [-7.2, 1.0872361496297984, 3.0],
        [-6.6, 1.0888746899447737, 2.6999999999999997],
        [-6.0, 1.0856651829173685, 2.4],
        [-5.5, 1.0786855062078962, 2.05],
        [-5.0, 1.069046283466542, 1.7],
        [-4.5, 1.0582751690271617, 1.35],
        [-4, 1.0480626409858003, 1]
      ],
      "enabled": true
    },
    {
      "routeId": "R02",
      "fromNode": "N01",
      "toNode": "N08",
      "durationMs": 75000,
      "bidirectional": true,
      "waypoints": [
        [-11.0, 1.0393662652318638, 5.0],
        [-10.75, 1.037100890592411, 5.6],
        [-10.5, 1.0334977794665727, 6.2],
        [-10.25, 1.031952455943539, 6.800000000000001],
        [-10.0, 1.0370088637859936, 7.4],
        [-9.428571428571429, 1.0337348241942759, 7.6000000000000005],
        [-8.857142857142858, 1.036539973856247, 7.800000000000001],
        [-8.285714285714286, 1.0431086608016304, 8.0],
        [-7.714285714285714, 1.0597048037556371, 8.200000000000001],
        [-7.142857142857142, 1.1077046273315316, 8.4],
        [-6.571428571428571, 1.165132398008435, 8.600000000000001],
        [-6.0, 1.1651532242498703, 8.8],
        [-5.375, 1.1053831905706764, 8.700000000000001],
        [-4.75, 1.102332152676217, 8.600000000000001],
        [-4.125, 1.1051788724491036, 8.5],
        [-3.5, 1.1183817119585229, 8.4],
        [-2.875, 1.144678732254849, 8.3],
        [-2.25, 1.1201317614888724, 8.2],
        [-1.625, 1.0946787426263678, 8.1],
        [-1, 1.0846364366509171, 8]
      ],
      "enabled": true
    },
    {
      "routeId": "R03",
      "fromNode": "N08",
      "toNode": "N02",
      "durationMs": 50000,
      "bidirectional": true,
      "waypoints": [
        [-1.0, 1.0846364366509171, 8.0],
        [-1.4, 1.0738427710136484, 7.54],
        [-1.8, 1.0631828295700327, 7.08],
        [-2.2, 1.0543633641736379, 6.62],
        [-2.6, 1.0486812281340385, 6.16],
        [-3.0, 1.0468324170253296, 5.7],
        [-3.25, 1.0462539002252234, 5.025],
        [-3.5, 1.0504721223803817, 4.35],
        [-3.75, 1.0569041773619514, 3.675],
        [-4.0, 1.0626143290772951, 3.0],
        [-4.0, 1.061131883096252, 2.3333333333333335],
        [-4.0, 1.0562466225130747, 1.6666666666666667],
        [-4, 1.0480626409858003, 1]
      ],
      "enabled": true
    },
    {
      "routeId": "R04",
      "fromNode": "N02",
      "toNode": "N05",
      "durationMs": 50000,
      "bidirectional": true,
      "waypoints": [
        [-4.0, 1.0480626409858003, 1.0],
        [-3.4, 1.042589173231966, 0.9199999999999999],
        [-2.8, 1.039385915230972, 0.84],
        [-2.2, 1.0389303446311764, 0.76],
        [-1.5999999999999996, 1.0413259704720264, 0.6799999999999999],
        [-1.0, 1.046288576177485, 0.6],
        [-0.33333333333333337, 1.0561344545953386, 0.3333333333333333],
        [0.33333333333333326, 1.067625077966698, 0.06666666666666665],
        [1.0, 1.0782959707067818, -0.2],
        [1.6666666666666665, 1.0929054286380069, -0.4666666666666667],
        [2.333333333333333, 1.2255167264100537, -0.7333333333333334],
        [3, 1.326, -1]
      ],
      "enabled": true
    },
    {
      "routeId": "R05",
      "fromNode": "N08",
      "toNode": "N05",
      "durationMs": 95000,
      "bidirectional": true,
      "waypoints": [
        [-1.0, 1.0846364366509171, 8.0],
        [-0.5, 1.0639532030300878, 7.5],
        [0.0, 1.0476869136067404, 7.0],
        [0.5, 1.031592893735131, 6.5],
        [1.0, 1.0191027758553506, 6.0],
        [1.1333333333333333, 1.0108729744977398, 5.366666666666667],
        [1.2666666666666666, 1.0073644378774667, 4.733333333333333],
        [1.4, 1.0088874260926781, 4.1],
        [1.5333333333333332, 1.0153359263235628, 3.466666666666667],
        [1.6666666666666667, 1.0259821051423081, 2.8333333333333335],
        [1.8, 1.039522571360406, 2.2],
        [2.04, 1.0551007240963735, 1.56],
        [2.2800000000000002, 1.0693256904886077, 0.9199999999999999],
        [2.52, 1.0942736038780967, 0.28000000000000025],
        [2.76, 1.2320404018366338, -0.3600000000000003],
        [3, 1.326, -1]
      ],
      "enabled": true
    },
    {
      "routeId": "R06",
      "fromNode": "N05",
      "toNode": "N06",
      "durationMs": 35000,
      "bidirectional": true,
      "waypoints": [
        [3.0, 1.326, -1.0],
        [3.6666666666666665, 1.326, -1.0],
        [4.333333333333333, 1.326, -1.0],
        [5.0, 1.326, -1.0],
        [5.666666666666667, 1.326, -1.0],
        [6.333333333333333, 1.326, -1.0],
        [7, 1.326, -1]
      ],
      "enabled": true
    },
    {
      "routeId": "R07",
      "fromNode": "N06",
      "toNode": "N07",
      "durationMs": 50000,
      "bidirectional": true,
      "waypoints": [
        [7.0, 1.326, -1.0],
        [7.4, 1.2083588421668887, -1.56],
        [7.8, 1.0497960996395126, -2.12],
        [8.2, 1.0433782414905413, -2.6799999999999997],
        [8.6, 1.0547187789089119, -3.2399999999999998],
        [9.0, 1.0664021899607037, -3.8],
        [9.52, 1.077031357509053, -4.24],
        [10.04, 1.084552678961615, -4.68],
        [10.56, 1.0873308335475145, -5.12],
        [11.08, 1.0846302209640728, -5.5600000000000005],
        [11.6, 1.0767696313885784, -6.0],
        [12.166666666666666, 1.0666526139916561, -6.333333333333333],
        [12.733333333333333, 1.0549843115932105, -6.666666666666667],
        [13.3, 1.043826660743639, -7.0],
        [13.866666666666667, 1.0351357205767293, -7.333333333333333],
        [14.433333333333334, 1.0303908141584959, -7.666666666666667],
        [15, 1.0303142489414885, -8]
      ],
      "enabled": true
    },
    {
      "routeId": "R08",
      "fromNode": "N05",
      "toNode": "N09",
      "durationMs": 70000,
      "bidirectional": true,
      "waypoints": [
        [3.0, 1.326, -1.0],
        [2.9285714285714284, 1.2397827925890512, -0.3571428571428572],
        [2.857142857142857, 1.1032364001067376, 0.2857142857142856],
        [2.7857142857142856, 1.0701703221219843, 0.9285714285714284],
        [2.7142857142857144, 1.0585064155032593, 1.5714285714285712],
        [2.642857142857143, 1.0463272684828289, 2.2142857142857144],
        [2.5714285714285716, 1.035302371883882, 2.8571428571428568],
        [2.5, 1.0267899178054778, 3.5],
        [2.7, 1.025922125594533, 4.140000000000001],
        [2.9, 1.0290316228921053, 4.78],
        [3.1, 1.034560844826907, 5.42],
        [3.3, 1.0404170899541871, 6.0600000000000005],
        [3.5, 1.044521771813623, 6.7],
        [4.125, 1.0087109468461308, 6.775],
        [4.75, 0.7550115684872428, 6.85],
        [5.375, 0.7488718815709924, 6.925],
        [6, 0.9476931089266111, 7]
      ],
      "enabled": true
    },
    {
      "routeId": "R09",
      "fromNode": "N09",
      "toNode": "N10",
      "durationMs": 70000,
      "bidirectional": true,
      "waypoints": [
        [6.0, 0.9476931089266111, 7.0],
        [6.6, 1.0809296570404343, 6.8],
        [7.2, 1.0856211084114662, 6.6],
        [7.8, 1.0864727278582929, 6.4],
        [8.4, 1.0832440196779385, 6.2],
        [9.0, 1.076445274784811, 6.0],